shopping,plataforma,tipo_post,data,caption,likes,comentarios,salvos,compartilhamentos,alcance,impressoes,engajamento
NS,Instagram,Carrossel,2026-01-29,"🎉 O carnaval vai ser ainda mais divertido no Blokinho Mário Rosa Kids! 🎶✨
No dia 08/02, o Nações Shopping se transforma no maior pré-carnaval infantil com Aventura Canina, brinquedos infláveis, ativid",38,4,1,11,7368,0,54
NS,Instagram,Reel,2026-01-29,"🎒 Está na correria para comprar material escolar? 🖍️ Não se preocupe, o Nações Shopping tem tudo o que você precisa para um início de ano mais tranquilo! ✨

Aqui, você encontra uma variedade incrível ",63,2,2,5,4816,0,72
NS,Instagram,Carrossel,2026-01-28,"🦁🌿 Mergulhe no mundo selvagem no Nações Shopping! 🌿🦁
A SmartZoo encanta crianças e adultos com animais animatrônicos em tamanho real! 🎥✨
São 20 espécies como leões, elefantes, girafas e até uma cobra ",127,1,4,49,7981,0,181
NS,Instagram,Reel,2026-01-28,"O Maior Blokinho Kids de Carnaval Chegou! Mario Rosa Kids 🎉
Prepare-se para um pré-carnaval imperdível no Nações Shopping! No dia 08/02, das 14h às 18h, as crianças terão uma tarde repleta de música, ",58,7,4,36,9641,0,105
NS,Instagram,Imagem,2026-01-27,"🎬 Atenção, amantes das telonas! 😍

A Semana do Cinema do GNC no Nações Shopping está chegando para deixar sua experiência ainda mais incrível!

De 5 a 11 de fevereiro, os ingressos estarão com o preço",322,1,28,511,9775,0,862
NS,Instagram,Reel,2026-01-27,"Carnapet no Nações Shopping! 🐾✨

No dia 07/02, às 16h, recebemos o evento mais fofo do ano: Carnapet! 🎉

Prepare seu pet para se divertir no nosso circuito pet, com desfile pelo mall, sorteio de brind",1924,22,20,112,45675,0,2078
NS,Instagram,Carrossel,2026-01-26,"Espetáculos Teatrais no Nações Shopping – 31/01 🎭

No dia 31/01, o Nações Shopping recebe duas incríveis peças teatrais para todos os públicos!

“As Viajantes do Tempo” às 18h: Três viajantes se reúne",87,19,5,86,8459,0,197
NS,Instagram,Reel,2026-01-26,"Já podemos sentir saudade desse domingo invadido pelas Heroínas do K-POP? 🎤

O evento foi um sucesso e deixou todo mundo com muita energia e diversão! ✨

Quem aí já está contando os dias para o próxim",738,61,21,340,24908,0,1160
NS,Instagram,Carrossel,2026-01-23,"Musical Heroínas do K-POP no Nações Shopping! 🎤✨
Prepare-se para um show imperdível com Mira, Zoey e Rumi, as Heroínas do K-POP, no dia 25/01, às 17h, na praça de alimentação! 🌟

Comente “Huntrix” se ",315,63,22,260,14347,0,660
NS,Instagram,Reel,2026-01-23,"🎉 O Blokinho Mário Rosa Kids está chegando! 

Marque na agenda: 08/02 (domingo) às 14h, no estacionamento do Nações Shopping, temos o evento Bloko Mário Rosa Kids 2026 com Tio Clô e a energia contagia",75,6,6,64,12622,0,151
NS,Instagram,Imagem,2026-01-23,Mais de 200 sonhos já foram realizados pelo Bloomin’ Day nos últimos anos. Um dia em que os pedidos de Bloomin’ Onion do @outbackbrasil são revertidos em doações para a @makeawishbrasil realizar sonho,31,0,0,2,3714,0,33
NS,Instagram,Carrossel,2026-01-22,"É o Brasil, é clima de comemoração!! ⚡️️ 

O Agente Secreto levou 4 indicações ao Oscar: Melhor Filme, Melhor Filme Internacional, Melhor Ator e Melhor Direção de Elenco. 🏆 

E segue em cartaz aqui no",75,1,1,10,5601,0,87
NS,Instagram,Reel,2026-01-22,"#TBT com um pedacinho do que você encontra no Nações Shopping! 🦁✨

Já imaginou viver uma experiência animatrônica incrível, rodeado por animais selvagens em tamanho real? A SmartZoo trouxe ao nosso sh",118,2,4,66,7099,0,190
NS,Instagram,Carrossel,2026-01-21,"🎉 O Maior Blokinho Kids do Sul está chegando! 🎉

Marque na agenda: 08/02 (domingo) às 14h, no estacionamento do Nações Shopping, temos o evento Bloko Rosa Kids 2026 com Tio Clô e a energia contagiante",36,3,2,22,8545,0,63
NS,Instagram,Reel,2026-01-20,"🌟 As Heroínas do K-POP: Huntrix no Nações Shopping! 🌟

Prepare-se para uma experiência única de K-POP com Mira, Zoey e Rumi! 💃🎤
O trio Huntrix vai agitar o palco com música, dança e muita energia em u",793,41,61,1352,32896,0,2247
NS,Instagram,Carrossel,2026-01-19,"🎒 Mochilas incríveis para a volta às aulas estão esperando por você na Bagaggio!

Do estilo mais descolado ao modelo mais clássico, tem opção para todos os gostos e necessidades. Vem conferir e garant",21,0,0,2,2441,0,23
NS,Instagram,Reel,2026-01-16,"Olhos cheios de lágrimas, muita emoção e um novo ano começando com um super presente! 
O Jeep Commander da Promoção de Natal do Nações Shopping já tem dono, e quem leva esse prêmio incrível é Regina P",1083,57,12,318,26629,0,1470
NS,Instagram,Imagem,2026-01-16,"🎉 Temos um ganhador! 

Com muita alegria anunciamos que a cliente Regina Potrikus é oa vencedora do Jeep Commander na promoção de Natal do Nações Shopping! 

A campanha premiou seis sortudos, um de ca",260,28,3,182,14644,0,473
NS,Instagram,Carrossel,2026-01-16,"Novidades GNC Cinemas: fique por dentro de tudo! 🎬✨

Separamos os melhores lançamentos e os mais procurados para você! Escolha o seu favorito e venha curtir no conforto do melhor cinema. 🍿💖

#cinema #",166,2,5,70,12215,0,243
NS,Instagram,Carrossel,2026-01-15,"🌎✨ A Vórtex Viagens chegou ao Nações Shopping! 

Para celebrar a inauguração da VORTEX VIAGENS, eles estão promovendo um presente inesquecível: sorteio de uma viagem completa de 3 dias para o Chile co",71,11,6,25,4880,0,113
NS,Instagram,Reel,2026-01-15,"Para animar seu dia, semana, mês! 🎉

Acaba de chegar no Nações Shopping: Royal Trudel, a deliciosa iguaria romena que vai conquistar seu paladar! 🍩✨

Com massa crocante e recheios irresistíveis, essa ",1882,101,95,3834,52177,0,5912
NS,Instagram,Reel,2026-01-14,"Para quem ama e procura Kipling, muitas opções na Tokaia do Nações Shopping. 👜✨

#NaçõesShopping #Criciúma #VoltaÀsAulas",49,0,3,7,4744,0,59
NS,Instagram,Reel,2026-01-13,"E se a gente te trouxer algumas dicas para essa Volta às Aulas? 🎒

Primeira parada: Fátima Papelaria! Muitas opções incríveis para você começar o ano letivo com o pé direito. 🖍️

Deixe aqui nos coment",54,2,5,12,8262,0,73
NS,Instagram,Carrossel,2026-01-13,"Quer saber como funciona nosso sorteio da promoção de Natal do Nações Shopping? 👉🏼Passe para o lado e confira. 

O sorteio será realizado pela Loteria Federal e acontecerá amanhã, 14/01. O resultado o",168,17,15,97,10833,0,297
NS,Instagram,Carrossel,2026-01-12,"📚✨ Volta às aulas no Nações Shopping

Tudo o que faz parte do começo do ano está aqui: mochilas, materiais, roupas, calçados e acessórios para todas as idades.

Porque quando a rotina começa bem, tudo",28,2,3,8,9705,0,41
NS,Instagram,Reel,2026-01-12,"🌿🐘 O reino animal chegou no Nações Shopping! 🦁

Prepare-se para a Exposição SmartZoo – Uma Jornada Animatrônica pelo Mundo Animal, inédita no Sul do Brasil! 

Com 20 animais em tamanho real, sons e mo",1740,29,66,2161,42579,0,3996
NS,Instagram,Reel,2026-01-11,Que tal um cineminha com o combo perfeito? 🍿🎥 Já marca aqui quem está te devendo um date assim!,339,4,6,46,11282,0,395
NS,Instagram,Carrossel,2026-01-10,"A Reserva invadiu sua praia 🏖️

Linha que te acompanha do primeiro mergulho ao último drink do dia. São tecidos nobres, modelagens impecáveis e cores exclusivas em peças leves e funcionais, feitas pra",37,0,0,5,7394,0,42
NS,Instagram,Carrossel,2026-01-09,"Muitas promoções imperdíveis! 🔥 SALE Nações Shopping — até 70% OFF

Essas e muitas outras lojas esperando por você! Corre aproveitar! 💥🛍️

#Sale #Descontos #Promoções #NaçõesShopping",67,0,1,8,4046,0,76
NS,Instagram,Reel,2026-01-09,"Liquida Pittol! 🔥

Corra para o Nações Shopping e aproveite! 🏃‍♀️💥
As ofertas são por tempo limitado!",29,0,3,1,4523,0,33
NS,Instagram,Reel,2026-01-09,"Estão preparados?! 🐘

Uma experiência animatrônica como nunca antes está para chegar! Com animais em tamanho real, sons e movimentos realistas, você vai se sentir no coração da selva. 🌿

Quem vai enca",692,30,47,994,30907,0,1763
NS,Instagram,Reel,2026-01-08,"COMEÇOU: Liquida Nações Shopping
Descontos de até 70% em diversas lojas! 👀🛍️
Não perca a chance de garantir aquele item que você tanto deseja.
Corra para o Nações Shopping e aproveite as oportunidades",33,1,0,15,6274,0,49
NS,Instagram,Imagem,2026-01-08,"🐾 Primeira Feira de Adoção Pet do Ano! 🐾
No dia 10/01, venha conhecer e adotar seu novo melhor amigo! 🐶🐱

📍 Em frente à Cobasi, das 11h às 17h
🔸 Evento gratuito
🔸 Adoção responsável

Traga sua família",124,12,5,37,8443,0,178
NS,Instagram,Story,2026-04-08,,0,0,0,0,0,0,0
NS,Instagram,Story,2026-04-08,,0,0,0,0,0,0,0
NS,Instagram,Story,2026-04-08,,0,0,0,0,0,0,0
NS,Instagram,Story,2026-04-08,,0,0,0,0,0,0,0
NS,Instagram,Story,2026-04-08,,0,0,0,0,0,0,0
NS,Instagram,Story,2026-04-08,,0,0,0,0,0,0,0
NS,Instagram,Story,2026-04-07,,0,0,0,0,1471,0,0
NS,Instagram,Story,2026-04-07,,0,0,0,0,1569,0,0
NS,Instagram,Story,2026-04-07,,0,0,0,0,1789,0,0
NS,Instagram,Story,2026-04-07,,0,0,0,0,1883,0,0
NS,Instagram,Story,2026-04-07,,0,1,0,0,1921,0,1
NS,Facebook,Video,2026-04-07,"Uma história que emociona dentro e fora das páginas. 🤍

O filme Uma Segunda Chance está em cartaz no GNC Cinemas, e para quem quiser se aprofundar ainda mais nessa história, o livro também está dispon",0,0,0,0,0,0,0
NS,Facebook,Imagem,2026-04-06,"🍄 A aventura vai ganhar vida no palco!

O musical inspirado no mundo do Super Mario Bross vai encantar o público com muita diversão, música e um universo cheio de nostalgia. ❤️

Um espetáculo para tod",0,0,0,0,0,0,0
NS,Facebook,Video,2026-04-06,A gente AMA esses achadinhos e quer levar TODOS! Pode vir que a @lojasrenner tá cheinha de novidades 🩷🎀,0,0,0,0,0,0,0
NS,Facebook,Video,2026-04-05,"Páscoa que transborda significado 🤍

A @lojacacaushownacoes, em parceria com o Nações Shopping, realizou a doação de chocolates para instituições da cidade: a @apaedeicara, a @casadainfanciacriciuma e",0,0,0,0,0,0,0
NS,Facebook,Video,2026-04-04,"Levanta a mão quem aqui ama uma boa promoção: 🙋‍♀️🙋‍♂️

Aqui no @bazarcasamaria você encontra muitas opções com qualidade e preço justo. Vem visitar! 🩷",0,0,0,0,0,0,0
NS,Facebook,Video,2026-04-03,"Os nossos aumigos não precisam ficar de fora dessa data tão especial: eles também têm um ovo de Páscoa pensado especialmente para eles. 💛🐾

O Ovo Joy você encontra na @cobasi 🐶",1,0,0,0,0,0,1
NS,Facebook,Video,2026-04-03,"📱 Imagina ganhar um IPhone 17 novinho na faixa? 

Confira o passo a passo e participe do sorteio pelo App AJFans. Cada compra pode se transformar em uma nova chance de ganhar.

A cada 100 pontos, você",1,0,0,0,0,0,1
NS,Facebook,Album,2026-04-02,"Confira nosso horário de funcionamento, para você aproveitar cada momento com conforto e tranquilidade. 🤍

Programe sua visita e venha curtir!",0,0,0,0,0,0,0
NS,Facebook,Video,2026-04-02,"🍫 Se for pra ganhar chocolate… que seja assim!

Envia esse vídeo pra aquela pessoa que precisa entender o que você quer de presente nessa Páscoa. 🐰",0,0,0,0,0,0,0
NS,Facebook,Video,2026-04-01,"Atenção que o filme “Super Mario Galaxy: O Filme” já está em cartaz! E a gente já se preparou com o balde pra hoje 🍄🤍

Garanta seu ingresso no site ingresso.com ou na nossa bilheteria.",0,0,0,0,0,0,0
NS,Facebook,Album,2026-04-01,"✨ Pode vir aproveitar o feriado com a gente!

O Nações Shopping estará aberto em horário normal, com tudo prontinho para você curtir, passear e aproveitar cada momento.",0,0,0,0,0,0,0
NS,Facebook,Video,2026-03-31,"Ainda dá tempo de garantir as compras de Páscoa! Na @kopenhagen_nacoesshopping você encontra muitas opções para presentear quem você ama 🎁🍫

Corre pra cá!",0,0,0,0,0,0,0
NS,Facebook,Video,2026-03-31,"👖✨ O jeans perfeito existe e você encontra na C&A!

Modelagens que valorizam, conforto para o dia a dia e aquele estilo versátil que combina com tudo. Escolha o seu favorito!",0,0,0,0,0,0,0
NS,Facebook,Album,2026-03-30,"🍫🐰🎁 A wish list de Páscoa está pronta!

Selecionamos os queridinhos que são sucesso garantido na hora de presentear opções deliciosas para surpreender e deixar a data ainda mais especial.

Agora é só ",2,0,0,0,0,0,2
NS,Facebook,Video,2026-03-29,"Nossa Caça aos Ovos desse sábado foi um sucesso! Todos os coelhinhos garantiram seus chocolates para uma Páscoa mais doce 🐰🩷

E quem não conseguiu ir, não fique triste: ano que vem tem mais!",1,0,0,0,0,0,1
NS,Facebook,Video,2026-03-29,"☀️🍨 Dia de calor pede… gelato!

Refrescante, cremoso e cheio de sabor, é a escolha perfeita para dar aquela pausa deliciosa no meio do dia. Vem se refrescar e aproveitar cada colherada na @officina.ge",1,0,0,0,0,0,1
NS,Facebook,Album,2026-03-29,"🎤 É hoje, às 17h, o musical Heroínas do K-pop: O Retorno promete encantar com muita música, dança e uma história cheia de atitude e emoção. 💜

Traga a família, chame os amigos e venha viver esse espet",2,0,0,0,0,0,2
NS,Facebook,Video,2026-03-28,"🌞🌴 Um pedacinho do Rio de Janeiro por aqui…

A Farm traz cor, leveza e aquela energia única que só o RJ tem. Vem sentir esse clima, se inspirar e levar um pouco desse lifestyle para o seu dia a dia.",0,0,0,0,0,0,0
NS,Facebook,Album,2026-03-27,"Uma coincidência que pode virar história! 🤍

O Nações Shopping está procurando uma criança muito especial: alguém que tenha nascido no dia 16 de abril de 2016, a mesma data da nossa inauguração. Em 20",1,0,0,1,0,0,2
NS,Facebook,Video,2026-03-27,"🍫🐰 A Páscoa fica ainda mais doce por aqui!

Na Cacau Show você encontra opções para todos os gostos: dos clássicos aos presentes mais especiais para surpreender quem você ama. Garanta suas compras de ",0,0,0,0,0,0,0
NS,Facebook,Imagem,2026-03-26,"🍄🎮 Ele está invadindo o Nações!

A pré-venda do filme ‘Super Mario Galaxy’ já está liberada! Prepare-se para viver essa experiência na telona e garantir seu lugar nessa jornada cheia de ação e nostalg",21,0,0,1,0,0,22
NS,Facebook,Video,2026-03-25,"✨ Últimos dias do Capivalley Parque!

Aproveite para viver essa experiência cheia de diversão, cores e momentos especiais com a família antes que acabe. 💛

Ainda dá tempo de viver tudo isso, mas corre",3,0,0,0,0,0,3
NS,Facebook,Video,2026-03-25,"Cuidado que entende a sua pele. 🤍✨

A ADCOS desenvolve dermocosméticos pensados especialmente para a pele brasileira, unindo tecnologia, ciência e resultados reais para o seu dia a dia.

Cada detalhe ",0,0,0,0,0,0,0
NS,Facebook,Album,2026-03-24,"📱 Seu próximo iPhone pode estar mais perto do que você imagina.

Confira o passo a passo e participe do sorteio pelo App AJFans. Cada compra pode se transformar em uma nova chance de ganhar.

A cada 1",0,0,0,0,0,0,0
NS,Facebook,Album,2026-03-24,"🍫 A melhor parte da Páscoa começa na escolha do ovo perfeito!

Preparamos uma seleção especial para todos os gostos, dos clássicos aos mais criativos, para deixar sua celebração ainda mais doce. 🐰

Pa",1,0,0,0,0,0,1
NS,Facebook,Album,2026-03-23,"🐰 A magia da Páscoa vai tomar conta do shopping!

No dia 28 de março, teremos uma Caça aos Ovos especial para a criançada, com muita diversão, doces e momentos encantadores aqui pelo Nações. 

Para pa",0,0,0,0,0,0,0
NS,Facebook,Video,2026-03-23,"Nosso musical de Páscoa foi lindo e emocionante! 🤍

Confira os melhores momentos.",1,0,0,0,0,0,1
NS,Facebook,Video,2026-03-22,"Passamos por momentos históricos no futebol. Cada camisa, uma conquista.

Mas a pergunta é: o que vem por aí? 👀 Deixe seu palpite nos comentários e se prepare para o lançamento! 🔥",0,0,0,0,0,0,0
NS,Facebook,Video,2026-03-22,"⚒️ A @lojacassol.criciuma no Mês da Construção: tudo o que você precisa para tirar seus planos do papel, do início ao acabamento.

E o melhor: loja aberta sábado e domingo para te atender quando você ",0,0,0,0,0,0,0
NS,Facebook,Video,2026-03-21,"O Brasileiro tá só por esse momento! 🇧🇷⚽️

A camisa oficial já está disponível na @centauroesporte ✅",0,0,0,0,0,0,0
NS,Facebook,Imagem,2026-03-20,"Imagina ganhar um iPhone 17 Black novinho? 😍 

Então, atenção para as regrinhas desse sorteio exclusivo no App AJFans:

1️⃣ Abra o app AJFans e cadastre suas notas fiscais de 19/03 a 19/04.
2️⃣ A cada",0,0,0,0,0,0,0
NS,Facebook,Video,2026-03-19,"Essa sexta é o #FeliciJah 🙃 

Pote de 360ml com todos os adicionais que você tem direito, por só R$16,99. Não vai perder, né? 😋",0,0,0,0,0,0,0
NS,Facebook,Imagem,2026-03-19,"O retorno mais esperado vai acontecer! ✨🎤

O musical Heroínas do K-pop: O Retorno promete emocionar com muita música, dança e uma história cheia de atitude e talento. 💜 Uma experiência pra quem ama o ",0,0,0,0,0,0,0
NS,Facebook,Album,2026-03-18,"Diversão não tem idade, só precisa ter vontade de aproveitar! 😄

No Nações Shopping, tem opções para crianças, jovens e adultos viverem momentos especiais do jeito que mais gostam. Chame a família, re",2,0,0,0,0,0,2
NS,Facebook,Video,2026-03-18,"Elegância que se destaca nos detalhes. 

A @aramisnacoes_oficial traduz o homem contemporâneo com peças que unem sofisticação, conforto e estilo em cada composição.

Para quem valoriza presença, quali",0,0,0,0,0,0,0
NS,Facebook,Album,2026-03-17,"🐰 Um espetáculo para emocionar e encantar!

A magia da Páscoa ganha vida em um show especial, com música, cores e uma mensagem que aquece o coração. 

Reúna a família, venha viver esse momento e celeb",0,0,0,0,0,0,0
NS,Facebook,Video,2026-03-17,"Um mix perfeito para a sua rotina de autocuidado. 🍒✨

Com hidratação na medida certa, um aroma irresistivelmente adocicado e aquele toque de refrescância que faz toda a diferença, a linha #PanvelMilks",0,0,0,0,0,0,0
NS,Facebook,Video,2026-03-17,"Domingo vai ser mágico! Traga toda a família e venha assistir esse musical que será especial e inesquecível. 🐰

Esperamos por você!",0,0,0,0,0,0,0
NS,Facebook,Video,2026-03-16,"Domingo viveremos a magia da Páscoa com o musical ‘Show da Vida’, na nossa praça de alimentação. Já chama a família, traga as crianças e venha celebrar essa data tão especial. 🐰🤍",0,0,0,0,0,0,0
NS,Facebook,Imagem,2026-03-16,"🐰 Um momento especial para toda a família!

No domingo (22), a praça de alimentação recebe o Musical de Páscoa – Show da Vida, um espetáculo cheio de música, emoção e uma linda mensagem para celebrar ",0,0,0,0,0,0,0
NS,Facebook,Imagem,2026-03-15,"Hoje tem encontro marcado com as capivaras mais queridas do Nações! 🧡🦫

Das 16h às 18h, o Cacá e a Capitu vão passear pelos corredores do shopping distribuindo abraços, sorrisos e muitas fotos fofas.
",0,0,0,0,0,0,0
NS,Facebook,Video,2026-03-15,"A Páscoa ganha ainda mais encanto nos detalhes. 🐰✨

A @camicado_criciuma preparou uma mesa de Páscoa cheia de charme e delicadeza, com peças que transformam qualquer encontro em um momento ainda mais ",1,0,0,0,0,0,1
NS,Facebook,Video,2026-03-14,"Nosso St. Patrick’s Festival com muito rock e chopp verde 🎤🍻🍀

Praça cheia, do jeitinho que a gente gosta! 💚",0,0,0,0,0,0,0
NS,Facebook,Video,2026-03-13,"🍀🍻💚 É neste sábado!

O clima do St. Patrick’s Day vai tomar conta do Nações Shopping com muita música, chopp e diversão.

A festa acontece na nossa Praça de Alimentação, com as bandas @vigariojack e @",3,0,0,0,0,0,3
NS,Facebook,Album,2026-03-11,"Tem coisa boa chegando por aqui… ✨

Algumas marcas já estão preparando seus espaços e, em breve, o Nações Shopping vai ganhar novas opções para você aproveitar ainda mais sua visita.

Fique atento por",1,0,0,0,0,0,1
NS,Facebook,Album,2026-03-11,"Tem coisa boa chegando por aqui… ✨

Algumas marcas já estão preparando seus espaços e, em breve, o Nações Shopping vai ganhar novas opções para você aproveitar ainda mais sua visita. 

Fique atento po",0,0,0,0,0,0,0
NS,Facebook,Video,2026-03-10,"#MilkMooDay: comprou um de 500ml, ganha outro de 300ml do mesmo sabor. Simples assim!

Perfeito para dividir… ou não. 👀

É amanhã! Já combina com a galera e vem!",1,0,0,0,0,0,1
NS,Facebook,Video,2026-03-09,"Cadê os fãs da saga? 🙌

Um clássico que marcou gerações está de volta às telonas. A pré-venda de Crepúsculo já começou, e essa é a chance perfeita de reviver toda a emoção no cinema.

🩸✨ Garanta seus ",0,0,0,0,0,0,0
NS,Facebook,Album,2026-03-09,"A semana em comemoração ao Dia do Consumidor começa com um combo de vantagens no nosso programa de relacionamento AJFans.

De 09 a 15 de março, tem benefícios exclusivos, cupons e descontos, ingressos",0,0,0,0,0,0,0
NS,Facebook,Video,2026-03-08,"Preparamos um lounge especial para celebrar o Dia da Mulher, pensado para acolher, inspirar e conectar. Um ambiente criado para receber mulheres incríveis em momentos de conversa, troca de experiência",0,0,0,0,0,0,0
NS,Facebook,Video,2026-03-08,"As capis mais amadas de Criciúma! ❤️

O musical do @capivalleyparque ensinou muito mais que música e diversão, ensinou sobre cuidar do meio ambiente! Fique com os melhores momentos dessa noite.",1,0,0,0,0,0,1
NS,Facebook,Video,2026-03-07,"A tarde está pedindo um café especial! Essa edição limitada de Páscoa já ganhou nosso coração por aqui. 🐰

Venha experimentar!",0,0,0,0,0,0,0
NS,Facebook,Album,2026-03-06,"Um mês inteiro de experiências esperando por você ✨

Preparamos uma programação especial com eventos para todos os gostos: música, diversão, atividades para a família e momentos para aproveitar cada v",1,0,0,0,0,0,1
NS,Facebook,Album,2026-03-05,"O clima do St. Patrick’s Day vai tomar conta da noite com muita música, energia e diversão! 💚🎶

No dia 15 de março, teremos banda ao vivo para celebrar essa data cheia de tradição, boas vibrações e mo",2,0,0,0,0,0,2
NS,Facebook,Video,2026-03-05,"Olha que convite especial! O musical ‘O Canto da Natureza’ será nesse sábado, às 18h, gratuito na nossa Praça de Alimentação 🤍 Você não pode perder!",0,0,0,0,0,0,0
NS,Facebook,Video,2026-03-04,"Dar um presente e montar uma pulseira Pandora é escolher, um a um, os símbolos que representam cada pessoa. 💎

Neste Dia da Mulher, presenteie com algo que tenha significado de verdade. Não é só uma j",0,0,0,0,0,0,0
NS,Facebook,Video,2026-03-03,"💚 Prepare-se para se encantar com “O Canto da Natureza”!

O musical das capivaras do @capivalleyparque chega para emocionar toda a família com uma história cheia de música e uma mensagem especial sobr",1,0,0,0,0,0,1
NS,Facebook,Album,2026-03-02,"Estão oficialmente abertas as inscrições para o concurso Miss Criciúma! 👑

Se você carrega beleza, atitude, propósito e amor pela nossa cidade, essa pode ser a sua oportunidade de representar Criciúma",0,0,0,0,0,0,0
NS,Facebook,Imagem,2026-03-02,"ARMY, é agora! 💜✨

O BTS WORLD TOUR ‘ARIRANG’ LIVE VIEWING chega ao GNC com dois momentos imperdíveis: direto de Goyang (11/04) e Tóquio (18/04). 🎤 Se prepare, aqueça a voz e venha viver essa experiên",0,0,0,0,0,0,0
NS,Facebook,Video,2026-03-01,"A gente já tá arrumando tudo pra data mais doce do ano: a Páscoa 🤍🐰

Visite nossas lojas e boas compras!",0,0,0,0,0,0,0
NS,Facebook,Video,2026-02-28,"As capivaras mais queridas chegaram aqui no Nações Shopping! 😍

O @capivalleyparque chegou e já está aberto! Traz todo mundo e vem! 💚",4,0,0,0,0,0,4
NS,Facebook,Video,2026-02-28,"Um encontro de energia boa, autocuidado e amor em forma de patinhas 🐾🤍🧘‍♀️

O Puppy Yoga foi muito mais do que uma aula: foi uma experiência que reuniu mulheres incríveis, momentos de conexão e doguin",1,0,0,0,0,0,1
NS,Facebook,Video,2026-02-27,"Neste sábado estaremos transmitindo o jogo BrusqueXCriciúma ao vivo a partir das 18h30 na nossa praça de alimentação. Passe na @tigremaniacos, compre sua camiseta nova e venha! 🐯

Esperamos por você.",0,0,0,0,0,0,0
NS,Facebook,Video,2026-02-27,"Postando esse vídeo com água na boca… 🤤

Se você ainda não veio visitar a Royal Trudel, esse vídeo é um sinal! 🤭",0,0,0,0,0,0,0
NS,Facebook,Imagem,2026-02-26,Comenta aqui embaixo que a gente quer saber! 👇,0,0,0,0,0,0,0
NS,Facebook,Video,2026-02-25,"Que tal sair da rotina? Um café diferente, um dia diferente… Você merece! 

Visite o Café Cultura e aproveite. 😉",1,0,0,0,0,0,1
NS,Facebook,Video,2026-02-24,"Eles estão indo embora… Mas você ainda pode vê-los! 

Amanhã, 24/02, é o último dia do Smart Zoo aqui no shopping. Não vai perder, né? A gente te espera! 🐅",1,0,0,0,0,0,1
NS,Facebook,Album,2026-02-23,"Já imaginou um parque temático inspirado na nossa amada capivara?

Vem aí o @capivalleyparque uma experiência inédita em Santa Catarina e totalmente dedicada às nossas queridas capivaras. Mais do que ",0,0,0,0,0,0,0
NS,Facebook,Video,2026-02-22,"Um sábado cheio de magia, música e imaginação ✨
O musical A Menina da Casa Mágica transformou nossa praça de alimentação em um mundo de fantasias e magia.✨✨",1,0,0,0,0,0,1
NS,Facebook,Video,2026-02-19,"✨ A magia vai tomar conta do Nações Shopping!

No dia 21 de fevereiro, às 17h, a praça de alimentação vira palco para o musical “A Menina da Casa Mágica” 🏡💫

Um espetáculo encantador, cheio de cores, ",1,0,0,0,0,0,1
NS,Facebook,Video,2026-02-18,"Pós-Carnaval do jeito que a gente ama: KFC + voltinha no shopping + zero pressa. 🍗✨

Porque a folia acaba, mas a vontade de aproveitar continua.

#nacoesshopping #kfc #criciuma",1,0,0,0,0,0,1
