shopping,plataforma,tipo_post,data,caption,likes,comentarios,salvos,compartilhamentos,alcance,impressoes,engajamento
CS,Instagram,Carrossel,2026-04-07,"Abril chegou e a telona da @cinepolisbrasil no Continente Shopping está pronta para receber os lançamentos mais aguardados do ano. Se você é fã de cinema, prepare a pipoca porque o mês está imperdível",171,3,9,103,4259,0,286
CS,Instagram,Carrossel,2026-04-07,"Abril é mês de conscientização, respeito e inclusão.

O Continente Shopping preparou uma programação especial de Abril Azul em parceria com @amafloripa com ações que convidam toda a comunidade a refle",76,7,2,71,1670,0,156
CS,Instagram,Carrossel,2026-04-06,"🎮 ATENÇÃO gamers de todas as idades!

A Arena Super Games está chegando no Continente Shopping trazendo a maior experiência gamer da região, uma verdadeira viagem pelos jogos que marcaram gerações.

P",156,4,19,177,5165,0,356
CS,Instagram,Carrossel,2026-04-06,"O mês mudou, mas o destino preferido continua o mesmo: Continente Shopping! 

Neste mês de abril, preparamos uma agenda especial para você viver momentos incríveis.

Lembrando que de segunda a quinta ",682,11,78,638,15580,0,1409
CS,Instagram,Reel,2026-04-05,"A Páscoa nos convida a renovar sentimentos, fortalecer laços e valorizar o que realmente importa: estar presente. 

Que este momento seja de união, esperança e novos começos, ao lado de quem faz a vid",334,5,5,21,8710,0,365
CS,Instagram,Carrossel,2026-04-04,"Em clima de Páscoa, nosso shopping se encheu de alegria! A nossa caça aos doces foi um sucesso e transformou o dia em uma experiência inesquecível para a criançada e suas famílias.

Acreditamos que a ",139,5,0,11,4827,0,155
CS,Instagram,Imagem,2026-04-03,"O filme do Mario chegou trazendo nostalgia, diversão e muita ação! E pra deixar tudo ainda mais épico, a @cinepolisbrasil preparou um balde de pipoca temático do Yoshi simplesmente incrível 🤩

Corre g",243,10,11,98,6751,0,362
CS,Instagram,Carrossel,2026-04-03,"Seu almoço de sexta-feira é no Continente Shopping!

Seja para manter a tradição com um peixe grelhado, saborear um risoto ou aproveitar um combo de sushi fresquinho, estamos prontos para receber você",42,4,1,9,2896,0,56
CS,Instagram,Reel,2026-04-02,"A época mais dulce do ano chegou. Páscoa Havanna com muuuuito Dulce de Leche @havannacontinente 

#continenteshopping #havanna #pascoa #dulcedeleche #dulcemomento",31,0,0,11,2674,0,42
CS,Instagram,Carrossel,2026-04-02,"A busca pelo ovo de Páscoa perfeito termina aqui! 🍫✨

Das opções clássicas as mais irresístiveis, nossas lojas estão recheadas de delícias para deixar o seu feriado inesquecível. E o melhor: sua compr",36,0,1,2,2984,0,39
CS,Instagram,Carrossel,2026-04-02,"Por um passeio mais leve e acolhedor para todos. ❤️🧩

Aqui no Continente Shopping, acreditamos que o lazer deve ser acessível e confortável para todos. Por isso, reforçamos nossas iniciativas de apoio",163,5,3,28,4165,0,199
CS,Instagram,Carrossel,2026-04-01,"Vai aproveitar o feriadão para passear, fazer compras de última hora ou curtir um cinema com a família? Confira nossos horários de funcionamento para este período:

🗓 Sexta-feira Santa (03/04):
🛍 Loja",69,0,2,20,5525,0,91
CS,Instagram,Carrossel,2026-03-31,"Direto pra uma nova galáxia… e com ingresso garantido 🚀🍄
 
A pré-venda de “Super Mario Galaxy: O Filme” já começou! Não perca a chance de viver essa aventura épica cheia de nostalgia e diversão.
 
Gar",146,6,6,66,4880,0,224
CS,Instagram,Reel,2026-03-30,"@eleveby26.continente não é só uma academia. É o começo de um novo nível.

Aqui, cada detalhe foi pensado para entregar experiência, performance e resultado: estrutura premium, energia certa e um ambi",42,0,1,1,2474,0,44
CS,Instagram,Reel,2026-03-28,"Páscoa do jeitinho que a gente ama! 🍫 

Chamamos a @lauracquadros e @kalliuporai para provar as novidades MAIS irresistíveis da @brasilcacau_continenteshopping… e olha, foi amor na primeira mordida! 🤤",271,93,9,76,14089,0,449
CS,Instagram,Reel,2026-03-26,"Suas compras no Continente Shopping valem um iPhone 17 Black! 

A @lauracquadros veio te mostrar como transformar suas notas fiscais em chances de ganhar o smartphone mais moderno do mercado. É simple",110,11,1,5,3504,0,127
CS,Instagram,Carrossel,2026-03-25,"📱 Seu próximo iPhone pode estar mais perto do que você imagina.

Confira o passo a passo e participe do sorteio pelo App AJFans. Cada compra pode se transformar em uma nova chance de ganhar.

A cada 1",34,1,3,11,3206,0,49
CS,Instagram,Carrossel,2026-03-24,"Tem coisas que são essenciais na Páscoa. O Ovo Recheado de Marshmallow da @goldko.continente é uma delas 🐰

Um marshmallow sem açúcar, com uma textura e sabor que só a GoldKo consegue entregar.

É o e",37,2,2,0,2963,0,41
CS,Instagram,Reel,2026-03-23,"A Amarelinha já está entre nós! O único manto com cinco estrelas no peito está pronto pra voar livre.

A nova camisa I da Seleção Brasileira acaba de chegar no Continente Shopping. Uma celebração para",171,13,3,18,4704,0,205
CS,Instagram,Reel,2026-03-22,"Quando viajamos, o nosso primeiro desejo é mergulhar na história e nos monumentos do destino, não é? 🌍 Mas e se a gente olhasse para a nossa própria cidade com esse mesmo olhar de turista?

Neste últi",225,12,10,16,4053,0,263
CS,Instagram,Imagem,2026-03-22,"Quer ganhar um iPhone 17 Black? É fácil, basta participar do sorteio exclusivo no App AJFans!

📝 Cadastre suas notas fiscais no app e ganhe 1 ponto a cada real gasto. Já é NewFan, SuperFan ou MegaFan?",20,0,3,3,2839,0,26
CS,Instagram,Carrossel,2026-03-21,"A magia só acontece de verdade quando temos um público tão especial para compartilhá-la! ✨💖

Hoje, o palco do Continente Shopping transbordou alegria com o musical “A Menina da Casa Mágica”. Ver cada ",283,11,6,72,7672,0,372
CS,Instagram,Carrossel,2026-03-19,"Absolute cinema 🍿 

Reviva o início de uma das sagas mais marcantes do cinema com reexibição de “Crepúsculo” nas telonas da @cinepolisbrasil 

De 19/03 a 25/03, volte a Forks e reviva novamente esse c",4365,55,127,1746,55892,0,6293
CS,Instagram,Reel,2026-03-19,"Entre tantas histórias que nasceram ao longo desses 276 anos, existe algo em comum: o orgulho de ser de São José. ✨

Uma cidade cheia de vida, que cresce junto com as pessoas que vivem aqui.

E o Cont",60,3,2,8,2745,0,73
CS,Instagram,Reel,2026-03-17,"Um palco cheio de histórias no coração de São José!

O Theatro Adolpho Mello acompanha a cidade desde o seu nascimento e já viveu muitas fases: de apresentações teatrais a cinema e até quartel. Hoje, ",209,27,4,29,4816,0,269
CS,Instagram,Carrossel,2026-03-17,"A semana está cheia de programação no Continente Shopping! Tem musical infantil e cinema com desconto para você aproveitar momentos especiais com a família, living painting, jazz ao vivo e promoções e",207,2,22,180,7577,0,411
CS,Instagram,Reel,2026-03-17,"✨ Promoção exclusiva para fãs de K-Pop!

Para celebrar o musical Guerreiras do K-Pop, a @anacapricontinente preparou um presente especial no Continente Shopping. 

👟 Na compra de um tênis da marca, vo",68,6,2,36,4417,0,112
CS,Instagram,Reel,2026-03-16,"Você sabe como começou a economia de São José?

No segundo episódio da nossa série especial de aniversário da cidade, o @guiamanezinho conta curiosidades sobre as atividades que movimentaram São José ",126,14,6,10,3589,0,156
CS,Instagram,Carrossel,2026-03-16,"Quem disse que jeans não é digno de tapete vermelho? ✨

Na cobertura da maior premiação do cinema, @caropita levou para Hollywood um look exclusivo criado a partir do denim da @cea_brasil. O vestido, ",15,0,2,2,2255,0,19
CS,Instagram,Reel,2026-03-15,"Quem disse que quem nasce no continente não é Manezinho? 👀 

Em comemoração aos 276 anos de São José, convidamos o nosso estimado @guiamanezinho para uma série super especial, cheia de histórias, curi",491,45,18,148,9078,0,702
CS,Instagram,Carrossel,2026-03-15,"A aventura vai começar! 🍄

Os ingressos para Super Mario Galaxy: O Filme já estão disponíveis na @cinepolisbrasil ⭐🎬

Prepare-se para embarcar nessa jornada pelo universo do Mario Galaxy e garantir se",1714,22,81,912,36692,0,2729
CS,Instagram,Reel,2026-03-14,"Já anota na agenda: 19/03 Aniversário de São José às 19h

🎟️ Evento gratuito no Continente Shopping.

O musical Heroínas do K-Pop chega ao Continente Shopping no dia 19/03, às 19h, com muita atitude, ",424,19,36,558,18401,0,1037
CS,Instagram,Reel,2026-03-13,"A gente veste a camisa. Desde sempre. 🇧🇷✨

A camisa da Seleção Brasileira chegou no Continente Shopping. 

Disponível nas lojas Nike Unite e Centauro. Garanta já a sua! ⚽️🔥

#copa #brasil #nike #centa",405,27,17,144,9179,0,593
CS,Instagram,Carrossel,2026-03-12,"Direto para o Uruguai, sem sair do Continente Shopping 🇺🇾

A @amanddasasso veio viver a experiência do @narbona.br o único restaurante da marca no Brasil, e se surpreendeu com uma gastronomia cheia de",69,2,6,3,2917,0,80
CS,Instagram,Reel,2026-03-12,Live especial de Páscoa na @kopenhagen_continenteshopping 🍫,16,0,0,2,1260,0,18
CS,Instagram,Carrossel,2026-03-12,"Cada momento pede uma escolha de JEANS @damyller diferente. Do conforto à atitude, cada modelagem traduz estilo e personalidade. A escolha é sua: qual delas acompanha melhor o seu dia a dia? Comenta a",12,0,1,0,1056,0,13
CS,Instagram,Imagem,2026-03-11,"Coelhinho da Páscoa, o que trazes pra mim? 🐰 

Muitos doces, diversão e uma caça especial pelo shopping para as crianças viverem a magia da Páscoa!

No dia 28 de março, sábado, o Continente Shopping c",237,35,42,264,10923,0,578
CS,Instagram,Carrossel,2026-03-11,"Nessa temporada, o @cafecultura escolheu celebrar o que é nosso: BRIGADEIRO. O doce mais afetivo, que tem gosto de abraço e memória, é o grande protagonista da nossa Páscoa!

Ele chega transformando n",74,4,2,21,2497,0,101
CS,Instagram,Carrossel,2026-03-10,"Dois musicais especiais chegam ao Continente Shopping para encantar públicos de todas as idades! 🎶✨

🎤 19/03 – Quinta-feira: Musical Heroínas do K-Pop
Às 19h, um espetáculo vibrante inspirado no unive",231,21,33,335,10580,0,620
CS,Instagram,Carrossel,2026-03-10,"A semana em comemoração ao Dia do Consumidor começa com um combo de vantagens no nosso programa de relacionamento AJFans.

De 09 a 15 de março, tem benefícios exclusivos, cupons e descontos, ingressos",510,4,100,777,17402,0,1391
CS,Instagram,Carrossel,2026-03-09,"A semana em comemoração ao Dia do Consumidor começa com um combo de vantagens no nosso programa de relacionamento AJFans.

De 09 a 15 de março, tem benefícios exclusivos, cupons e descontos, ingressos",15,1,2,3,1311,0,21
CS,Instagram,Reel,2026-03-05,"Especial dia da mulher: unimos o cuidado da @adcoscontinente com a doçura irresistível da @goldko.continente para criar uma experiência especial.

Confira nossa programação especial para os dias 7 e 8",68,16,1,6,3434,0,91
CS,Instagram,Carrossel,2026-03-04,"Os filmes mais aguardados de 2026 🎬✨

Já salva esse post e manda pra aquela pessoa que vai sentar do seu lado na @cinepolisbrasil pra conferir todos esses lançamentos 🍿👀

#continenteshopping #cinema #",1674,20,269,1845,23629,0,3808
CS,Instagram,Carrossel,2026-03-03,"O mês mudou, mas o destino preferido continua o mesmo: Continente Shopping! 

Neste mês de março, preparamos uma agenda especial para você viver momentos incríveis.

Lembrando que de segunda a quinta ",2814,37,402,3312,63933,0,6565
CS,Instagram,Imagem,2026-03-01,"Já anota na agenda: 19/03 Aniversário de São José às 19h

Elas cantam, dançam, inspiram e conquistam 🎤 

O musical Heroínas do K-Pop chega ao Continente Shopping no dia 19/03, às 19h, com muita atitud",418,23,68,635,13283,0,1144
CS,Instagram,Carrossel,2026-02-28,"Homem do Sapato no Continente Shopping

Agora, você tem à disposição uma linha exclusiva de calçados masculinos com qualidade e sofisticação para todos os momentos. Do look casual ao mais formal, a Ho",57,0,0,3,2609,0,60
CS,Instagram,Reel,2026-02-26,"Ainda em ritmo de folia por aqui! 🥁✨ Nosso #TBT de hoje é pra relembrar os sorrisos e a energia contagiante do nosso Carnaval.

Queremos agradecer a cada um de vocês que trouxe animação, fantasias cri",72,12,3,13,3854,0,100
CS,Instagram,Carrossel,2026-02-25,"Luzes apagadas.
Coração acelerado.
Balde na mão.

A pré-venda de #Pânico7 já está aberta! O filme estreia dia 26 de fevereiro, mas já terá sessões especiais a partir do dia 25, somente nos cinemas. Co",415,7,7,151,6388,0,580
CS,Instagram,Carrossel,2026-02-24,"O Inverno 2026 da @chua_continente já começou a chegar. 

O Preview de Inverno é o convite perfeito para renovar o closet com as tendências que acabaram de sair das passarelas. Peças versáteis, cortes",19,1,1,7,1531,0,28
CS,Instagram,Carrossel,2026-02-22,"O @narbona.br chegou ao Continente Shopping!

A primeira unidade no Brasil do renomado restaurante uruguaio traz uma experiência gastronômica única, com vinhos próprios, pratos autênticos e uma fábric",57,6,3,13,3085,0,79
CS,Instagram,Carrossel,2026-02-21,"Última chamada para os pequenos protetores da natureza! 🌿🦦

O @capivalleyparque está vivendo seus últimos dias aqui no @continenteshopping e você não pode deixar essa aventura passar. É a oportunidade",39,2,2,25,5627,0,68
CS,Instagram,Reel,2026-02-19,"Estávamos esperando por isso há muito tempo! 🔪🖤

#Pânico7 estreia dia 26 de fevereiro na @cinepolisbrasil. Um novo capítulo da clássica franquia do cinema. Garanta agora seu lugar.

🍿 Balde já disponí",385,65,4,144,9851,0,598
CS,Instagram,Reel,2026-02-19,#tbt de um musical inédito em Santa Catarina! Ainda estamos encantados com o Musical das Capivaras que aconteceu aqui no Continente Shopping. Quem viveu esse momento com a gente sabe o quanto foi espe,40,1,2,7,3510,0,50
CS,Instagram,Carrossel,2026-02-19,"Hoje é o dia perfeito pra reunir a galera, trocar ideia e aproveitar um burguer de respeito! 🍔🔥 @bombeefburgers 

🚘 Aproveite para almoçar no Continente Shopping com estacionamento gratuito de segunda",21,2,2,2,1554,0,27
CS,Instagram,Carrossel,2026-02-18,"Que energia incrível! 🙌🎊 O Carnaval no Continente Shopping chegou ao fim, mas as memórias que criamos juntos vão ficar por muito tempo. Queremos agradecer a todos que trouxeram sua animação, suas fant",98,18,2,34,4227,0,152
CS,Instagram,Carrossel,2026-02-16,"Nossas capivarinhas deram um show de talento, mas o verdadeiro espetáculo aconteceu na plateia. Ficamos encantados com a animação das famílias e a recepção calorosa que deram ao nosso musical 💜

Agrad",79,12,1,14,3808,0,106
CS,Instagram,Reel,2026-02-15,"Confira a programação de carnaval:
🍃 Segunda-feira: Musical das Capivaras às 17h
🐾 Terça-feira: Carnapet das 14h às 16h
🥳 Terça-feira: Bailinho Kids das 16h às 18h

A folia está garantida no Continent",33,4,0,13,2765,0,50
CS,Instagram,Carrossel,2026-02-15,"Um pedacinho do Uruguai agora aqui!

No @narbona.br cada detalhe conta uma história de tradição e sabor. Comece sua jornada explorando nossa seleção de vinhos exclusivos, vindos diretamente de Terraza",33,2,1,8,2587,0,44
CS,Instagram,Reel,2026-02-14,"MUSICAL INÉDITO DAS CAPIVARAS NESTA SEGUNDA

Nesta segunda-feira, às 17h, tem apresentação especial do musical das capivaras no Continente Shopping, na Praça de Alimentação, e o melhor: evento gratuit",51,9,5,26,4196,0,91
CS,Instagram,Carrossel,2026-02-13,"Procurando um programa diferente para este Carnaval? No Continente Shopping, a folia é para os apaixonados por história e nostalgia.

Vem aí a Feira de Colecionismo, um encontro imperdível para quem a",268,18,19,125,6412,0,430
CS,Instagram,Carrossel,2026-02-12,"Já prepara a pipoca e atualize a sua lista! 🎬🍿 O ano de 2026 promete ser um ano incrível para quem não dispensa uma ida ao cinema. Tem de tudo: do mundo da moda à ficção científica, passando por roman",407,2,47,332,7997,0,788
CS,Instagram,Reel,2026-02-12,"VEM PRO BAILINHO DO CONTINENTE! 🎊🎭

Anota na agenda para não esquecer:
🗓 Terça-feira, 17/02
⏰ A partir das 16h
📍 Praça de Alimentação do Continente Shopping

A Isis já escolheu a fantasia e espera por",104,16,10,111,4775,0,241
CS,Instagram,Reel,2026-02-11,"Procurando o salão perfeito para o seu Glow Up de Carnaval? ✨

No @frankdferranfloripa a gente prepara o seu visual para brilhar do primeiro acorde até o último bloco! Seja um penteado que aguenta a f",63,18,5,15,4046,0,101
CS,Instagram,Carrossel,2026-02-10,"Esperou o ano inteiro pelo carnaval? 🥳🎉 Aqui você encontra looks e acessórios que vão fazer seu visual brilhar no bloco, avenida e rolê. Descubra o seu favorito.

#continenteshopping #carnaval #look",13,0,1,0,1462,0,14
CS,Instagram,Carrossel,2026-02-03,"Alerta de fofura máxima passando no seu feed! 🚨🐾

Já conhece a Capiloja? É o lugar oficial para você levar um pedacinho do @capivalleyparque para casa. Da pelúcia da Capitu aos acessórios mais descola",47,1,1,11,4003,0,60
CS,Instagram,Carrossel,2026-02-02,"Cinema por R$10?! A SEMANA DO CINEMA NA CINÉPOLIS está chegando… e vai ser IM-PER-DÍ-VEL! 🎬✨

Prepare-se para iniciar a contagem regressiva, porque vem aí dias inteiros de cinema do jeito que você ama",3698,44,353,7034,79360,0,11129
CS,Instagram,Reel,2026-02-01,"Se você achou que a parte 1 já tinha resolvido o problema do calor, calma que a @lauracquadros vai te mostrar muita lá opções gostosas e geladas para refrescar! 🍨 

Nossa busca pela sobremesa perfeita",118,8,9,21,8667,0,156
CS,Instagram,Carrossel,2026-01-31,"Neste final de semana tem o encontro com as capivaras mais amadas: Capitu e Cacá aqui no @capivalleyparque, das 14h às 16h.

Muito mais do que um parque de diversões, é uma experiência lúdica onde as ",59,0,0,6,3757,0,65
CS,Instagram,Carrossel,2026-01-28,"Hoje é o Dia Internacional do #lego e por aqui a gente sabe: não existem limites para quem tem um bloco na mão e uma ideia na cabeça. 

Seja para montar naves espaciais, cidades inteiras ou aquele car",32,0,2,3,2006,0,37
CS,Instagram,Carrossel,2026-01-27,"Procurando um programa imperdível para a criançada gastar energia?

Na Terça Maluca do @wow.park a diversão é garantida pela METADE do preço! Todas as terças-feiras, todos os ingressos do parque saem ",105,4,17,96,6737,0,222
CS,Instagram,Reel,2026-01-27,"O tênis preferido dos corredores brasileiros agora nas cores da @oficialworldtennis 🏃🏻 

O Olympikus Corre 4 ganhou uma edição limitada e exclusiva em comemoração aos 35 anos da loja que mais entende ",105,10,6,58,5884,0,179
CS,Instagram,Reel,2026-01-25,"Ô abre alas que eu quero passar! 🥳🎊

O Carnaval do Continente Shopping já tem data marcada! Dia 17/02 (terça-feira de Carnaval) teremos o clássico BAILINHOS KIDS e CARNAPET.

Já anota na agenda e venh",38,2,6,39,5582,0,85
CS,Instagram,Carrossel,2026-01-25,"Vencedor do Globo de Ouro de Melhor Filme de Drama, “Hamnet: A Vida Antes de Hamlet” já está nas telas do Continente Shopping. Sob o olhar poético da diretora Chloé Zhao, acompanhamos a história de An",37,0,2,4,3927,0,43
CS,Instagram,Carrossel,2026-01-24,"Neste sábado tem o encontro com as capivaras mais amadas: Capitu e Cacá aqui no @capivalleyparque, das 14h às 16h.

Muito mais do que um parque de diversões, é uma experiência lúdica onde as crianças ",67,0,2,17,2811,0,86
CS,Instagram,Carrossel,2026-01-24,"Chegou o momento de tornar sonhos realidade! ✨ No dia 24/01, o Bloomin’ Day do @outbackbrasil vai transformar o seu pedido de Bloomin’ Onion em impacto social. Toda a venda líquida dos produtos partic",22,0,1,1,1643,0,24
CS,Instagram,Reel,2026-01-24,"O primeiro parque inspirado nas nossas amadas Capivaras: o @capivalleyparque fica até dia 22 de fevereiro aqui no Continente Shopping!

Meet & Greet com Cacá e Capitu: sábado e domingo, das 14h às 16h",137,9,8,52,5969,0,206
CS,Instagram,Carrossel,2026-01-23,"Chegou o momento de tornar sonhos realidade! ✨ No dia 24/01, o Bloomin’ Day do @outbackbrasil vai transformar o seu pedido de Bloomin’ Onion em impacto social. Toda a venda líquida dos produtos partic",16,0,1,6,3006,0,23
CS,Instagram,Carrossel,2026-01-23,"O primeiro parque inspirado nas nossas amadas Capivaras: o @capivalleyparque fica até dia 22 de fevereiro aqui no Continente Shopping!

Meet & Greet com Cacá e Capitu: sábado e domingo, das 14h às 16h",30,1,1,9,2507,0,41
CS,Instagram,Carrossel,2026-01-22,"O @arquipelagosushilounge chegou ao Continente Shopping para elevar o conceito de gastronomia japonesa. Aqui, o sushi de alta qualidade encontra o frescor de drinks autorais em um ambiente tão aconche",55,0,11,17,3757,0,83
CS,Instagram,Carrossel,2026-01-22,"O que já era completo, ficou ainda melhor! O Continente Shopping não para de crescer e as nossas últimas inaugurações chegaram para provar que somos o seu destino favorito em Santa Catarina. 

Tem gas",348,3,17,41,14619,0,409
CS,Instagram,Reel,2026-01-22,"Elas são o momento! 😍 O material está pronto para mais um ano letivo 🎒✨ Marca aqui aquele amigo que é apaixonado por capivaras. 👇

#escola #capybaralove #continenteshopping #voltaasaulas2026",21,3,2,3,2025,0,29
CS,Instagram,Reel,2026-01-21,"O primeiro parque inspirado nas nossas amadas Capivaras: o @capivalleyparque fica até dia 22 de fevereiro aqui no Continente Shopping!

Meet & Greet com Cacá e Capitu: sábado e domingo, das 14h às 16h",44,2,2,10,2474,0,58
CS,Instagram,Carrossel,2026-01-20,"Não é apenas um filme, é um acontecimento para o cinema brasileiro! 🇧🇷

“O Agente Secreto” não para de colecionar elogios e indicações ao redor do mundo. Da recepção calorosa nos bastidores de Cannes ",42,0,0,3,2130,0,45
CS,Instagram,Reel,2026-01-20,"Seu verão com @manly.wear ☀️ 

#continenteshopping #manly #beachwear #summer",82,15,5,26,2784,0,128
CS,Instagram,Carrossel,2026-01-19,"Para quem vive o Continente Shopping: baixe o nosso super app AJFans e aproveite benefícios exclusivos, brindes especiais e muito mais! 🎁📲 Não perca as promoções incríveis e aproveite cada momento no ",24,3,0,12,1977,0,39
CS,Instagram,Carrossel,2026-01-18,"Parabéns, Capitu! @capivalleyparque estamos felizes demais em fazer parte da sua história 💚

Já veio conferir a nova atração do Continente Shopping?

📍 Onde: Praça de Eventos do Continente Shopping
⏰ ",59,1,0,11,2942,0,71
CS,Instagram,Carrossel,2026-01-17,"Já trouxe os pequenos para conhecer o @capivalleyparque?

Neste domingo, dia 18, nossa querida Capitu apaga as velinhas e todos vocês estão convidados para essa celebração inesquecível no primeiro par",64,3,2,10,3428,0,79
CS,Instagram,Reel,2026-01-16,"CARIOCA: uma nova coleção desenhada no Rio, vestida no mundo todo. Descubra os lançamentos na @farmcontinente_ 

#continenteshopping #farm #moda #rio",52,0,3,3,3274,0,58
CS,Instagram,Reel,2026-01-16,"O ano começou com emoção!

O Jeep Commander da Promoção de Natal do Continente Shopping já tem dona e quem leva esse prêmio incrível é Cecilia Silveira Vilamil 🚙🎄

A ação contemplou seis clientes, um ",1559,86,22,287,31398,0,1954
CS,Instagram,Reel,2026-01-16,"O ano começou com emoção!

O Jeep Commander da Promoção de Natal do Continente Shopping já tem dona e quem leva esse prêmio incrível é Cecilia Silveira Vilamil 🚙🎄

A ação contemplou seis clientes, um ",328,26,2,56,7625,0,412
CS,Instagram,Imagem,2026-01-16,"🎉 Temos uma ganhadora! 

Com muita alegria anunciamos que a cliente Cecília Silveira Vilamil é o vencedora do Jeep Commander na promoção de Natal do Continente Shopping! 

A campanha premiou seis sort",142,23,1,84,7429,0,250
CS,Instagram,Reel,2026-01-15,"Simplesmente viciados nos helados da @havannabr 

A marca argentina trouxe para cá a sua linha exclusiva de Helados: sorvetes premium feitos com ingredientes selecionados e, claro, aquele toque inconf",78,6,4,38,3708,0,126
CS,Instagram,Carrossel,2026-01-15,"📚✨ Volta às aulas no Continente Shopping

Tudo o que faz parte do começo do ano está aqui: mochilas, materiais, roupas, calçados e acessórios para todas as idades.

Porque quando a rotina começa bem, ",29,0,1,1,3412,0,31
CS,Instagram,Carrossel,2026-01-14,"As FÉRIAS DIVERTIDAS do Continente Shopping estão repletas de opções para toda a família, principalmente para a criançada. Dá só uma olhada em tudo de lazer que você encontra por aqui! 😎☀️🍿🎲🎳🎮👾 #conti",88,6,9,22,5171,0,125
CS,Instagram,Carrossel,2026-01-13,"Tem festa no @capivalleyparque 🥳🎈

Neste domingo, dia 18, nossa querida Capitu apaga as velinhas e todos vocês estão convidados para essa celebração inesquecível no primeiro parque temático de capivar",50,0,0,15,3444,0,65
CS,Instagram,Carrossel,2026-01-13,"Quer saber como funciona nosso sorteio da promoção de Natal do Continente Shopping? 

👉🏼 Passe para o lado e confira. 

O sorteio será realizado pela Loteria Federal e acontecerá amanhã, 14/01. O resu",178,24,23,77,5360,0,302
CS,Instagram,Carrossel,2026-01-12,"Férias combinam com cinema cheio, pipoca na mão e todo mundo junto 🍿 

Na @cinepolisbrasil dá pra curtir tudo isso com 4 ingressos por R$ 19,90 cada.​

Escolha o filme, chame a galera e aproveite o me",596,28,81,1450,14529,0,2155
CS,Instagram,Reel,2026-01-11,"POV: Entrando na magia do @reinodaneve ⛄️✨

Capturamos tudo em primeira pessoa para vocês sentirem um pouquinho de como é brincar na nossa atração de gelo. É o cenário perfeito para gastar energia e s",230,14,10,77,9778,0,331
